{
  "schemaVersion": 1,
  "generatedAt": "2026-07-28T00:52:46.790Z",
  "package": "openclaw",
  "channels": {
    "stable": "2026.7.1-2",
    "previous": "2026.6.33",
    "preview": "2026.7.2-beta.4"
  },
  "releases": [
    {
      "channel": "stable",
      "version": "2026.7.1-2",
      "status": "probing",
      "reportPath": "releases/openclaw-2026.7.1-2.json",
      "generatedAt": "2026-07-28T00:52:17.435Z",
      "upstreamPublishedAt": "2026-07-18T03:53:48.967Z",
      "reportLatencySeconds": 853108,
      "runtimeEvidence": false,
      "artifact": {
        "integrity": "sha512-ycF3yPcbjN6bUPeaUx6Mh6vze1hQWoD3CT/wWcmD7a8xaHHHRUaAlaq+lFxMHf1ssEgODVAwjlzYqp2twkYZ7g==",
        "unpackedBytes": 87477902,
        "directDependencyCount": 56,
        "nativeRiskCount": 13,
        "shrinkwrapConsistent": false,
        "shrinkwrapMissingCount": 31,
        "shrinkwrapMismatchedCount": 0
      },
      "checks": {
        "pass": 1,
        "warn": 3,
        "fail": 0,
        "pending": 15
      },
      "dependencyChangesFromStable": {
        "added": [],
        "removed": [],
        "changed": []
      },
      "dependencyRiskFromStable": [],
      "gatewayContractFromStable": {
        "classification": "unchanged",
        "inspection": {
          "stable": "complete",
          "release": "complete"
        },
        "protocol": {
          "stable": {
            "current": 4,
            "minClient": 4,
            "minProbe": 3,
            "minNode": 3
          },
          "release": {
            "current": 4,
            "minClient": 4,
            "minProbe": 3,
            "minNode": 3
          },
          "changed": false
        },
        "distribution": {
          "legacyPluginDeclarationCount": {
            "stable": 0,
            "release": 0,
            "delta": 0
          },
          "publicDeclarationChanged": false,
          "publicRuntimeChanged": false,
          "versionModuleChanged": false,
          "serverMethodsChanged": false
        },
        "coreMethods": {
          "added": [],
          "removed": []
        },
        "schemaExports": {
          "added": [],
          "removed": []
        },
        "validators": {
          "added": [],
          "removed": []
        },
        "eventSchemas": {
          "added": [],
          "removed": []
        }
      },
      "deltaFromStable": {
        "unpackedBytes": 0,
        "directDependencyCount": 0,
        "nativeRiskCount": 0,
        "shrinkwrapMissingCount": 0
      }
    },
    {
      "channel": "previous",
      "version": "2026.6.33",
      "status": "probing",
      "reportPath": "releases/openclaw-2026.6.33.json",
      "generatedAt": "2026-07-28T00:52:21.289Z",
      "upstreamPublishedAt": "2026-07-21T11:25:55.513Z",
      "reportLatencySeconds": 566786,
      "runtimeEvidence": false,
      "artifact": {
        "integrity": "sha512-53MCYfnMEzQmrh/mFNpqfUcQunZASPZ2qYOmqn6wq3K4gZPzV0QOMwjxOCU2C+VmQ5FqzVU8exy7j7pyL3EBzQ==",
        "unpackedBytes": 86557604,
        "directDependencyCount": 54,
        "nativeRiskCount": 13,
        "shrinkwrapConsistent": false,
        "shrinkwrapMissingCount": 31,
        "shrinkwrapMismatchedCount": 0
      },
      "checks": {
        "pass": 1,
        "warn": 3,
        "fail": 0,
        "pending": 15
      },
      "dependencyChangesFromStable": {
        "added": [],
        "removed": [
          {
            "name": "@openclaw/ai",
            "spec": "2026.7.1-2"
          },
          {
            "name": "@silvia-odwyer/photon-node",
            "spec": "0.3.4"
          }
        ],
        "changed": [
          {
            "name": "@agentclientprotocol/sdk",
            "stableSpec": "1.1.0",
            "releaseSpec": "0.22.1"
          },
          {
            "name": "@anthropic-ai/sdk",
            "stableSpec": "0.109.1",
            "releaseSpec": "0.100.1"
          },
          {
            "name": "@clack/core",
            "stableSpec": "1.4.2",
            "releaseSpec": "1.3.1"
          },
          {
            "name": "@clack/prompts",
            "stableSpec": "1.6.0",
            "releaseSpec": "1.4.0"
          },
          {
            "name": "@earendil-works/pi-tui",
            "stableSpec": "0.80.3",
            "releaseSpec": "0.78.0"
          },
          {
            "name": "@google/genai",
            "stableSpec": "2.10.0",
            "releaseSpec": "2.7.0"
          },
          {
            "name": "@mistralai/mistralai",
            "stableSpec": "2.4.0",
            "releaseSpec": "2.2.5"
          },
          {
            "name": "@openclaw/fs-safe",
            "stableSpec": "0.4.1",
            "releaseSpec": "0.3.0"
          },
          {
            "name": "commander",
            "stableSpec": "15.0.0",
            "releaseSpec": "14.0.3"
          },
          {
            "name": "grammy",
            "stableSpec": "1.44.0",
            "releaseSpec": "1.43.0"
          },
          {
            "name": "openai",
            "stableSpec": "6.45.0",
            "releaseSpec": "6.39.1"
          },
          {
            "name": "playwright-core",
            "stableSpec": "1.61.1",
            "releaseSpec": "1.60.0"
          },
          {
            "name": "quickjs-wasi",
            "stableSpec": "3.0.2",
            "releaseSpec": "3.0.0"
          },
          {
            "name": "tar",
            "stableSpec": "7.5.19",
            "releaseSpec": "7.5.20"
          },
          {
            "name": "typebox",
            "stableSpec": "1.3.3",
            "releaseSpec": "1.1.39"
          },
          {
            "name": "web-tree-sitter",
            "stableSpec": "0.26.10",
            "releaseSpec": "0.26.9"
          }
        ]
      },
      "dependencyRiskFromStable": [
        {
          "name": "@agentclientprotocol/sdk",
          "change": "changed",
          "declaredSpec": "0.22.1",
          "resolvedVersion": "0.22.1",
          "integrity": "sha512-DfqXtl/8gO9NImq094MTaCXEU2vkhh6v7q/kT+9UjZxUqj8hYaya2OjLVIqn16MzNHcXEpShTR2RIauLSYeDQQ==",
          "scan": {
            "packageFileCount": 34,
            "sourceFileCount": 10,
            "sourceBytes": 246020,
            "truncated": false
          },
          "signals": {
            "lifecycleScripts": [],
            "nativeArtifacts": [],
            "wasmArtifacts": [],
            "nodeBuiltins": [
              "child_process",
              "path",
              "readline/promises",
              "stream",
              "url"
            ],
            "networkApis": [
              "fetch"
            ],
            "sourceSignals": [],
            "browserCapabilities": [
              "network",
              "subprocess",
              "terminal"
            ]
          }
        },
        {
          "name": "@anthropic-ai/sdk",
          "change": "changed",
          "declaredSpec": "0.100.1",
          "resolvedVersion": "0.100.1",
          "integrity": "sha512-RANcEe7LpiLczkKGOwoXOTuFdPhuubS0i4xaAKOMpcqc55YO0mukgxppV7eygx3DXNjxWT6RYOLPyOy0aIAmwg==",
          "scan": {
            "packageFileCount": 1258,
            "sourceFileCount": 278,
            "sourceBytes": 1177239,
            "truncated": false
          },
          "signals": {
            "lifecycleScripts": [],
            "nativeArtifacts": [],
            "wasmArtifacts": [],
            "nodeBuiltins": [
              "buffer",
              "child_process",
              "crypto",
              "fs",
              "fs/promises",
              "path",
              "readline",
              "stream",
              "stream/promises",
              "util"
            ],
            "networkApis": [
              "@anthropic-ai/sdk",
              "@modelcontextprotocol/sdk",
              "fetch"
            ],
            "sourceSignals": [
              "process.env"
            ],
            "browserCapabilities": [
              "cryptography",
              "environment",
              "filesystem",
              "network",
              "subprocess",
              "terminal"
            ]
          }
        },
        {
          "name": "@clack/core",
          "change": "changed",
          "declaredSpec": "1.3.1",
          "resolvedVersion": "1.3.1",
          "integrity": "sha512-fT1qHVGAag4IEkrupZ6lRRbNCs1vS9P01KB/sG8zKgvUztbYtFBtQpjSITNwooDZ83tpsPzP0mRNs1/KVszCRA==",
          "scan": {
            "packageFileCount": 7,
            "sourceFileCount": 1,
            "sourceBytes": 23869,
            "truncated": false
          },
          "signals": {
            "lifecycleScripts": [],
            "nativeArtifacts": [],
            "wasmArtifacts": [],
            "nodeBuiltins": [
              "process",
              "readline",
              "tty",
              "util"
            ],
            "networkApis": [],
            "sourceSignals": [],
            "browserCapabilities": [
              "terminal"
            ]
          }
        },
        {
          "name": "@clack/prompts",
          "change": "changed",
          "declaredSpec": "1.4.0",
          "resolvedVersion": "1.4.0",
          "integrity": "sha512-S0My7XPGIgpRWMDG8uRqalbgT+a6FmCUdOW+HaIOVVpUPHOb7RrpvjTjiODadKp06fsrVDJZlIzc6yCTp4AnxA==",
          "scan": {
            "packageFileCount": 7,
            "sourceFileCount": 1,
            "sourceBytes": 30802,
            "truncated": false
          },
          "signals": {
            "lifecycleScripts": [],
            "nativeArtifacts": [],
            "wasmArtifacts": [],
            "nodeBuiltins": [
              "fs",
              "path",
              "process",
              "util"
            ],
            "networkApis": [],
            "sourceSignals": [
              "process.env"
            ],
            "browserCapabilities": [
              "environment",
              "filesystem"
            ]
          }
        },
        {